{"contract_version":4,"scenario":"gaines-2025","statement":"Hypothetical: what could happen if one infectious person arrived in Gaines County, given its population and kindergarten MMR coverage. This is not a reconstruction or forecast of the 2025 outbreak.","seed":"20250304","run_count":1000,"seeding":{"geography":"48165","initial_infectious":1,"initial_exposed":0,"start_week":{"year":2025,"week":27},"assumption":"one infectious person are introduced into Gaines County at the start week, and every other simulated county starts with none. This is a stated assumption for the hypothetical, not data: no source supports these counts and none is claimed, and it is not derived from any case report.","start_week_basis":"A neutral reference week: the MMWR week containing July 1, 2025, the reference date of the Census population estimate. The engine has no seasonality, so the start week only labels day 0 of the calendar and changes no result. It is not a claim about when the 2025 outbreak began.","limitation":"The county is modelled as one well-mixed population whose immunity is its kindergarten MMR coverage applied to every resident (see the engine notes in seir.rs). Real outbreaks cluster in close communities and are shaped by reporting and interventions that this scenario does not model, so its totals are not comparable with reported cases."},"parameters":[{"parameter":"r0","value":{"kind":"uniform_prior","max":18.0,"min":12.0},"source":"Guerra et al. (2017), Lancet Infect Dis, systematic review of measles R0","url":"https://pubmed.ncbi.nlm.nih.gov/28757186/","note":"\"For measles, R0 is often cited to be 12-18\". A conventional range, not a locally calibrated prior; the uniform density is a demonstration modelling assumption. Each simulated run draws its own R0."},{"parameter":"latent_period_days","value":10.0,"source":"CDC Pink Book, chapter 13 (Measles)","url":"https://www.cdc.gov/pinkbook/hcp/table-of-contents/chapter-13-measles.html","note":"Exposure to rash onset averages 14 days and the case is transmissible from 4 days before rash onset, so latent = 14 - 4 = 10 days, the low end of the spec's 10-12 day band. The 11-12 day figure is incubation to symptoms, not to infectiousness."},{"parameter":"infectious_period_days","value":8.0,"source":"CDC Pink Book, chapter 13 (Measles)","url":"https://www.cdc.gov/pinkbook/hcp/table-of-contents/chapter-13-measles.html","note":"Transmissible from 4 days before through 4 days after rash onset, 8 days. Treating this window as an exponential mean is an explicit SEIR approximation."},{"parameter":"mmr_effectiveness_one_dose","value":0.93,"source":"CDC, MMR vaccine considerations","url":"https://www.cdc.gov/measles/hcp/vaccine-considerations/index.html","note":"One dose is 93% (range 39% to 100%) effective at preventing measles. A point estimate, not a measured immunity. Retained in the scenario but unused by the engine: v1 has no one-dose-only coverage."},{"parameter":"mmr_effectiveness_two_doses","value":0.97,"source":"CDC, MMR vaccine considerations","url":"https://www.cdc.gov/measles/hcp/vaccine-considerations/index.html","note":"Two doses are 97% (range 67% to 100%) effective. Applied to kindergarten MMR coverage as all-or-none protection and as a proxy for residents of every age (see seir.rs); a demonstration assumption, not measured population immunity."},{"parameter":"time_step_days","value":1.0,"source":"Koplik spec E4 (thoughts/shared/project/koplik-spec.md)","url":null,"note":"A numerical choice (daily tau-leaping), not a biological estimate."},{"parameter":"horizon_days","value":180,"source":"Koplik spec E4 (thoughts/shared/project/koplik-spec.md)","url":null,"note":"A six-month demonstration window, an explicit product choice, not a fitted value."},{"parameter":"gravity","value":null,"source":"Xia, Bjørnstad & Grenfell (2004), Am Nat 164(2):267-281; Bharti et al. (2008)","url":"https://doi.org/10.1086/422341","note":"No coupling by default: no calibrated Texas mobility parameters exist in this engine and published fits from other settings are not transplanted to Texas (see gravity.rs). Counties are simulated in isolation unless a scenario supplies explicit coefficients."}],"nodes":[{"geography":"48165","name":"Gaines County","population":23956,"population_basis":"U.S. Census Bureau Vintage 2025 county population estimate, July 1, 2025 (POPESTIMATE2025); not back-cast to any other date","centroid_basis":"Census 2025 Gazetteer county internal point (INTPTLAT, INTPTLONG): a representative point, not a population-weighted or geometric centroid","coverage_school_year":"2023-24","coverage_basis":"Texas DSHS kindergarten MMR coverage for the last completed school year before the 2025 outbreak, as published (not imputed)"}],"excluded_nodes":[],"neighbourhood_note":"Gaines County is simulated alone. The engine's cited defaults carry no gravity coupling (no calibrated Texas mobility parameters exist), so another county would be an inert node and none is published."}
